{
  "eventId": "a1b2c3d4-e5f6-4a7b-8c9d-0e1f2a3b4c5d",
  "eventType": "PaymentProcessed",
  "eventVersion": 1,
  "occurredAt": "2026-09-24T10:00:02Z",
  "correlationId": "5b0f6f5c-9a8e-4d3c-b2a1-f0e9d8c7b6a5",
  "producer": "payment-service",
  "payload": {
    "paymentId": "c1d2e3f4-a5b6-4c7d-8e9f-0a1b2c3d4e5f",
    "orderId": "3f2b1c9e-8d7a-4e6f-b5a4-1c2d3e4f5a6b",
    "userId": "9a8b7c6d-5e4f-4a3b-8c2d-1e0f9a8b7c6d",
    "userEmail": "a@b.com",
    "amount": "99.98",
    "currency": "GBP",
    "processedAt": "2026-09-24T10:00:02Z"
  }
}
